{
  "schema_version": "1.0",
  "generated_by": "erp-tech-director",
  "title": "Enterprise Resource Planning (ERP) System Development",
  "goals": [
    "Develop a comprehensive ERP system with core business modules",
    "Implement user authentication and role-based access control",
    "Create intuitive web-based user interfaces for all modules",
    "Design scalable microservices architecture",
    "Establish automated testing and deployment pipelines",
    "Ensure system security and data protection compliance"
  ],
  "non_functional": [
    "System must handle 1000+ concurrent users",
    "Response time under 2 seconds for standard operations",
    "99.9% uptime availability requirement",
    "GDPR and data privacy compliance",
    "Mobile-responsive design for all interfaces",
    "Audit trail for all business transactions"
  ],
  "tech_stack": {
    "frontend": {
      "framework": "Vue.js 3",
      "state_management": "Pinia",
      "ui_library": "Element Plus",
      "router": "Vue Router",
      "http_client": "Axios",
      "build_tool": "Vite"
    },
    "backend": {
      "framework": "Flask (Python)",
      "orm": "SQLAlchemy",
      "authentication": "JWT (Flask-JWT-Extended)",
      "api_specification": "RESTful API",
      "cors": "Flask-CORS",
      "environment_management": "python-dotenv"
    },
    "database": {
      "primary": "PostgreSQL 17",
      "connector": "psycopg2-binary",
      "management_tool": "pgAdmin"
    },
    "authentication": {
      "method": "JWT Token",
      "permission_control": "RBAC (Role-based Access Control)",
      "token_storage": "localStorage/sessionStorage",
      "api_protection": "@jwt_required decorator"
    }
  },
  "risks": [
    "Complex integration requirements between modules may cause delays",
    "Performance bottlenecks with large datasets need careful optimization",
    "Security vulnerabilities in authentication system require thorough testing",
    "Database migration complexity during development iterations",
    "Third-party API dependencies may introduce stability issues"
  ],
  "milestones": [
    {
      "id": "M1",
      "desc": "Complete technical architecture and database design",
      "due": "2025-09-14"
    },
    {
      "id": "M2",
      "desc": "Implement authentication system and core user management",
      "due": "2025-09-21"
    },
    {
      "id": "M3",
      "desc": "Develop frontend components and backend APIs for main modules",
      "due": "2025-10-05"
    },
    {
      "id": "M4",
      "desc": "Complete integration testing and performance optimization",
      "due": "2025-10-12"
    },
    {
      "id": "M5",
      "desc": "Deploy production environment and conduct user acceptance testing",
      "due": "2025-10-19"
    }
  ]
}